{
  "$schema": "../../../../../schemas/pbr_material_definitions.schema.json",
  "version": 1,
  "notes": [
    "All values are floats. Roughness/metallic/noise are generally in [0.0, 1.0].",
    "Emissive intensity and scale multipliers may exceed 1.0.",
    "These values are intended as deterministic defaults for generating packed *_pbr.png maps:",
    "  R = roughness, G = metallic, B = 0, A = 1.",
    "Per-pixel metallic is not inferred; use overrides to mark entire textures/material families as metallic.",
    "Roughness values for: brick, concrete, glass, water, ice, snow, charcoal, office paper, and base metals were aligned to the PhysicallyBased.info materials database.",
    "Materials not present in that database remain heuristics and may need art-direction tuning."
  ],
  "defaults": {
    "roughness": 0.85,
    "metallic": 0.0,
    "noise": {
      "roughness": 0.05,
      "metallic": 0.0,
      "normals": 0.05
    },
    "scale": {
      "roughness": 1.0,
      "metallic": 1.0,
      "emissive": 1.0,
      "normal": 0.3,
      "depth": 0.3
    }
  },
  "materials": {
    "default_block": { "roughness": 0.85, "metallic": 0.0 },
    "default_texture": { "roughness": 0.85, "metallic": 0.0 },
    "block_creature": { "roughness": 0.7, "metallic": 0.0 },
    "block_overlay": { "roughness": 0.9, "metallic": 0.0 },
    "block_food": { "roughness": 0.65, "metallic": 0.0 },
    "block_creative": { "roughness": 0.55, "metallic": 0.0 },
    "block_meta": { "roughness": 0.7, "metallic": 0.0 },
    "block_devastation": { "roughness": 0.9, "metallic": 0.0 },
    "block_christmas": { "roughness": 0.55, "metallic": 0.0 },
    "block_locustnest": { "roughness": 0.8, "metallic": 0.0 },
    "block_pile": { "roughness": 0.8, "metallic": 0.0 },
    "block_legacy": { "roughness": 0.7, "metallic": 0.0 },

    "bone": { "roughness": 0.9, "metallic": 0.0 },
    "creature_wet": { "roughness": 0.6, "metallic": 0.0 },
    "coral": { "roughness": 0.75, "metallic": 0.0 },

    "food_dairy": { "roughness": 0.35, "metallic": 0.0 },
    "food_grain": { "roughness": 0.85, "metallic": 0.0 },
    "food_meal": { "roughness": 0.2, "metallic": 0.0 },
    "food_pie": { "roughness": 0.55, "metallic": 0.0 },

    "christmas_bauble": { "roughness": 0.2, "metallic": 0.0 },
    "christmas_present": { "roughness": 0.55, "metallic": 0.0 },

    "dirt": { "roughness": 0.95, "metallic": 0.0 },
    "grass": { "roughness": 0.9, "metallic": 0.0, "scale": { "normal": 0.05, "depth": 0.1 } },
    "plant": { "transmission": 0.35, "roughness": 0.9, "metallic": 0.0, "scale": { "normal": 0, "depth": 0 } },
    "mud": { "roughness": 0.97, "metallic": 0.0 },
    "clay": { "roughness": 0.9, "metallic": 0.0 },
    "sand": { "roughness": 0.9, "metallic": 0.0 },
    "gravel": { "roughness": 0.92, "metallic": 0.0 },
    "stone": { "roughness": 0.92, "metallic": 0.0 },
    "rock": { "roughness": 0.9, "metallic": 0.0 },
    "brick": { "roughness": 0.9, "metallic": 0.0 },
    "concrete": { "roughness": 0.5, "metallic": 0.0 },
    "plaster": { "roughness": 0.85, "metallic": 0.0 },

    "wood": { "roughness": 0.7, "metallic": 0.0 },
    "bark": { "roughness": 0.78, "metallic": 0.0 },
    "log": { "roughness": 0.75, "metallic": 0.0 },
    "planks": { "roughness": 0.65, "metallic": 0.0 },
    "wicker": { "roughness": 0.8, "metallic": 0.0 },
    "paper": { "roughness": 0.8, "metallic": 0.0 },

    "cloth": { "roughness": 0.9, "metallic": 0.0 },
    "wool": { "roughness": 0.93, "metallic": 0.0 },
    "leather": { "roughness": 0.75, "metallic": 0.0 },

    "ceramic": { "roughness": 0.55, "metallic": 0.0 },
    "pottery": { "roughness": 0.6, "metallic": 0.0 },
    "terracotta": { "roughness": 0.65, "metallic": 0.0 },

    "glass": { "roughness": 0.05, "metallic": 0.0 },
    "water": { "roughness": 0.02, "metallic": 0.0 },
    "ice": { "roughness": 0.5, "metallic": 0.0 },
    "snow": { "roughness": 0.5, "metallic": 0.0 },
    "lava": { "roughness": 0.1, "metallic": 0.0, "emissive": 10.0 },
    "fire": { "roughness": 1.0, "metallic": 0.0, "emissive": 3.0, "scale": { "normal": 0.0, "depth": 0.0 } },
    "ember": { "roughness": 1.0, "metallic": 0.0, "emissive": 1.0, "scale": { "normal": 0.0, "depth": 0.0 } },
    "warm_lamp": { "roughness": 0.65, "metallic": 0.0, "emissive": 0.25, "scale": { "normal": 0.0, "depth": 0.0 } },

    "candle_lit": { "roughness": 0.6, "metallic": 0.0, "emissive": 0.35 },
    "torch_flammable_lit": { "roughness": 1.0, "metallic": 0.0, "emissive": 1.0, "scale": { "normal": 0.0, "depth": 0.0 } },
    "torch_lit": { "roughness": 0.75, "metallic": 0.0, "emissive": 0.15 },
    "bioluminescent": { "roughness": 0.8, "metallic": 0.0, "emissive": 0.25 },
    "tech_glow": { "roughness": 0.45, "metallic": 0.0, "emissive": 0.35 },
    "soft_glow": { "roughness": 0.6, "metallic": 0.0, "emissive": 0.15, "scale": { "normal": 0.0, "depth": 0.0 } },
    "ember_faint": { "roughness": 1.0, "metallic": 0.0, "emissive": 0.12, "scale": { "normal": 0.0, "depth": 0.0 } },
    "luminescent_liquid": { "roughness": 0.02, "metallic": 0.0, "emissive": 0.6, "scale": { "normal": 0.0, "depth": 0.0 } },
    "tar": { "roughness": 0.08, "metallic": 0.0 },
    "honey": { "roughness": 0.05, "metallic": 0.0 },

    "coal": { "roughness": 0.7, "metallic": 0.0 },
    "charcoal": { "roughness": 0.9, "metallic": 0.0 },

    "rust": { "roughness": 0.95, "metallic": 0.0 },
    "painted": { "roughness": 0.6, "metallic": 0.0 },
    "polished_stone": { "roughness": 0.35, "metallic": 0.0 },

    "metal_generic": { "roughness": 0.35, "metallic": 0.75, "noise": { "roughness": 0.025, "metallic": 0.02 }, "scale": { "normal": 0.02, "depth": 0.02 } },
    "metal_iron": { "roughness": 0.35, "metallic": 0.75, "noise": { "roughness": 0.025, "metallic": 0.02 }, "scale": { "normal": 0.02, "depth": 0.02 } },
    "metal_steel": { "roughness": 0.3, "metallic": 0.75, "noise": { "roughness": 0.025, "metallic": 0.02 }, "scale": { "normal": 0.02, "depth": 0.02 } },
    "metal_copper": { "roughness": 0.28, "metallic": 0.75, "noise": { "roughness": 0.025, "metallic": 0.02 }, "scale": { "normal": 0.02, "depth": 0.02 } },
    "metal_tin": { "roughness": 0.3, "metallic": 0.75, "noise": { "roughness": 0.025, "metallic": 0.02 }, "scale": { "normal": 0.02, "depth": 0.02 } },
    "metal_zinc": { "roughness": 0.3, "metallic": 0.75, "noise": { "roughness": 0.025, "metallic": 0.02 }, "scale": { "normal": 0.02, "depth": 0.02 } },
    "metal_gold": { "roughness": 0.18, "metallic": 0.75, "noise": { "roughness": 0.025, "metallic": 0.02 }, "scale": { "normal": 0.02, "depth": 0.02 } },
    "metal_silver": { "roughness": 0.15, "metallic": 0.75, "noise": { "roughness": 0.025, "metallic": 0.02 }, "scale": { "normal": 0.02, "depth": 0.02 } },
    "metal_bronze": { "roughness": 0.25, "metallic": 0.75, "noise": { "roughness": 0.025, "metallic": 0.02 }, "scale": { "normal": 0.02, "depth": 0.02 } }
  },
  "mapping": [
    {
      "id": "survival-metal-blocks",
      "description": "Mark typical metal block texture families as metallic.",
      "match": {
        "glob": "assets/**/textures/block/**/metal/**/*.png"
      },
      "values": {
        "material": "metal_generic"
      }
    },
    {
      "id": "vge-example-explicit-overrides-do-not-match",
      "description": "Example only: explicit texture overrides (this glob intentionally matches nothing).",
      "match": {
        "glob": "assets/vanillagraphicsexpanded/textures/__example__/never_matches.png"
      },
      "values": {
        "material": "stone",
        "overrides": {
          "materialParams": "mymod:textures/vge/params/stone/granite_pbr.png",
          "normalHeight": "mymod:textures/vge/normalheight/stone/granite_nh.dds"
        }
      }
    },
    {
      "id": "vge-example-materialparams-scale-do-not-match",
      "description": "Example only: scale the packed materialParams override channels (this glob intentionally matches nothing).",
      "match": {
        "glob": "assets/vanillagraphicsexpanded/textures/__example__/never_matches_material_scale.png"
      },
      "values": {
        "material": "stone",
        "overrides": {
          "materialParams": "mymod:textures/vge/params/stone/granite_pbr.png",
          "scale": {
            "roughness": 1.25,
            "metallic": 0.75,
            "emissive": 2.0
          }
        }
      }
    },
    {
      "id": "vge-example-normalheight-scale-do-not-match",
      "description": "Example only: scale the packed normalHeight override channels (this glob intentionally matches nothing).",
      "match": {
        "glob": "assets/vanillagraphicsexpanded/textures/__example__/never_matches_normal_scale.png"
      },
      "values": {
        "material": "stone",
        "overrides": {
          "normalHeight": "mymod:textures/vge/normalheight/stone/granite_nh.dds",
          "scale": {
            "normal": 1.1,
            "depth": 0.5
          }
        }
      }
    },
    {
      "id": "water-liquid-blocks",
      "description": "Water textures used for liquid blocks.",
      "match": {
        "glob": "assets/**/textures/block/liquid/water*.png"
      },
      "values": {
        "material": "water"
      }
    },
    {
      "id": "saltwater-liquid-blocks",
      "description": "Saltwater textures used for liquid blocks.",
      "match": {
        "glob": "assets/**/textures/block/liquid/saltwater*.png"
      },
      "values": {
        "material": "water"
      }
    },
    {
      "id": "lava-liquid-blocks",
      "description": "Lava textures used for liquid blocks.",
      "match": {
        "glob": "assets/**/textures/block/liquid/lava*.png"
      },
      "values": {
        "material": "lava"
      }
    },
    {
      "id": "fire-blocks",
      "description": "Flame/fire textures used for blocks (emissive).",
      "match": {
        "glob": "assets/**/textures/block/fire.png"
      },
      "values": {
        "material": "fire"
      }
    },
    {
      "id": "fire-variant-blocks",